{
  "artifact_profile": "synthetic-copy-v1",
  "artifact_status": "m04_scaffold_not_runtime_loadable",
  "byte_totals": {
    "excluded_tensor_bytes": 16,
    "excluded_tensor_count": 1,
    "output_tensor_bytes": 176,
    "output_tensor_count": 3,
    "source_tensor_count": 4
  },
  "compiler": {
    "commit": "0000000000000000000000000000000000000000",
    "dependencies_lock_sha256": "a6df4681ee1d2cb34a914e0a4aabe492daf8f12d50b80c70f98bdd7b7389de37",
    "dirty": false,
    "implementation": "gem16_compile_m04_v1",
    "platform": {
      "byteorder": "little",
      "locale": "C.UTF-8",
      "machine": "x86_64",
      "python_implementation": "CPython",
      "python_major_minor": "3.14",
      "python_version": "3.14.6",
      "system": "Linux"
    },
    "python": "3.14.6",
    "repository": "Danmoreng/gem16"
  },
  "compiler_settings": {
    "host_memory_cap_bytes": 536870912,
    "reference_platform_strict": false,
    "resume_policy": "restart-only",
    "staging_buffer_bytes": 65536,
    "threads": 1
  },
  "excluded_tensors": [
    {
      "family": "vision",
      "reason": "text-only M04 synthetic fixture",
      "residency_class": "compile_excluded_vision",
      "role": "vision_projection",
      "source_bytes": 16,
      "source_dtype": "BF16",
      "source_name": "model.vision_tower.patch_embedder.input_proj.weight",
      "source_range": {
        "absolute_offset": 392,
        "byte_length": 16,
        "range_identity_sha256": "048d96997d6020542bfd727e0f39c0fb4b015162b27a3e621a3dbe10c27dbe22",
        "shard": "model-00001-of-00002.safetensors",
        "shard_sha256": "574547c04aed92d0e27cc5ebe483e270031c1b0ebb4a4117187b83492d8cd346"
      },
      "source_shape": [
        2,
        4
      ],
      "source_tensor_sha256": "ec71c1aeb2041ab3ff278dfba88e93457d91354dd415313f23cbd1c7d6a15669"
    }
  ],
  "file_hash_scope": "all artifact files except gem16_compilation.json; its self-hash is supplied by the external artifact lock in M08",
  "files": [
    {
      "kind": "source_metadata_copy",
      "path": "chat_template.jinja",
      "sha256": "c716ab540e94154e63631b6d0bd4f6975ed660e2343a68be49d9692aa05465f8",
      "size": 24
    },
    {
      "kind": "source_metadata_copy",
      "path": "config.json",
      "sha256": "8a22161fd99aad23827438ce3ecd1f710899a4bbe3e7c44f1ec40b4fb97ea034",
      "size": 130
    },
    {
      "kind": "source_metadata_copy",
      "path": "generation_config.json",
      "sha256": "55ef4ff32aef443352374b1a2a8500c3e484d33b6e1dccf6dd2ae7debda45ace",
      "size": 34
    },
    {
      "kind": "safetensors_shard",
      "path": "model-00001-of-00002.safetensors",
      "sha256": "2c616501be79146b5ca2233c240c7797a199e41c2ba73c1eacda89d7e987e2d7",
      "size": 320
    },
    {
      "kind": "safetensors_shard",
      "path": "model-00002-of-00002.safetensors",
      "sha256": "cb8c1a8801293f71cb2aff6e141fe565cbc636500fb87a0fbaff3cc0d7b68176",
      "size": 352
    },
    {
      "kind": "safetensors_index",
      "path": "model.safetensors.index.json",
      "sha256": "a5ff807714bd9b0af8566a667ad59a6af2a92214ef039c98e7aecd6c65676743",
      "size": 341
    },
    {
      "kind": "source_metadata_copy",
      "path": "tokenizer.json",
      "sha256": "bbc9a1a0ef426afb685ae587d3fa726bb067c85b5854000960c2b2866c475126",
      "size": 76
    },
    {
      "kind": "source_metadata_copy",
      "path": "tokenizer_config.json",
      "sha256": "3b593f5305c104273dfa35b56c6c70313462038b7a85ba13aa2fa1164479fc92",
      "size": 48
    }
  ],
  "head_format": "source",
  "omitted_families": [
    "audio",
    "mtp",
    "video",
    "vision"
  ],
  "omitted_tensor_groups": [
    {
      "group": "audio",
      "reason": "absent from source and excluded by text-only profile",
      "source_bytes": 0,
      "source_tensor_count": 0
    },
    {
      "group": "mtp",
      "reason": "absent from source and excluded by text-only profile",
      "source_bytes": 0,
      "source_tensor_count": 0
    },
    {
      "group": "video",
      "reason": "absent from source and excluded by text-only profile",
      "source_bytes": 0,
      "source_tensor_count": 0
    },
    {
      "group": "vision",
      "reason": "text-only M04 synthetic fixture",
      "source_bytes": 16,
      "source_tensor_count": 1
    }
  ],
  "plan": {
    "compiler_manifest_sha256": "6294abda5ccd428f7fe672fd4e95d0fa52f57f7f263c9b99ce22aa52a5c991fc",
    "resolved_plan_sha256": "6294abda5ccd428f7fe672fd4e95d0fa52f57f7f263c9b99ce22aa52a5c991fc",
    "schema_version": 1,
    "source_contract": "gemma4_26b_m04_synthetic_source_v1",
    "target_shard_bytes": 96
  },
  "quantization": {
    "attention": "copy-v1-scaffold",
    "embedding_head": "source-copy-v1",
    "experts": "copy-v1-scaffold",
    "production_quantization_implemented": false,
    "profile": "synthetic-copy-v1"
  },
  "schema_version": 1,
  "source": {
    "lock_sha256": "dd252602387b8dcd6939a6aca9336b1d11e8608a873540cef95e698f208bf2d1",
    "repository": "gem16/synthetic-gemma4-26b-m04",
    "resolved_at_utc": "2026-08-11T00:00:00Z",
    "revision": "1111111111111111111111111111111111111111"
  },
  "tensors": [
    {
      "aliased": true,
      "axis_transformation": "identity",
      "byte_length": 128,
      "dequantization_equation": "output = source",
      "disk_layout": "source_bf16",
      "logical_dtype": "BF16",
      "logical_shape": [
        16,
        4
      ],
      "operation_id": "copy:model.language_model.embed_tokens.weight",
      "output_data_offsets": [
        0,
        128
      ],
      "output_dtype": "BF16",
      "output_name": "model.language_model.embed_tokens.weight",
      "output_shard": "model-00001-of-00002.safetensors",
      "physical_shape": [
        16,
        4
      ],
      "quantizer_parameters": {},
      "residency_class": "compiler_scaffold_text",
      "role": "tied_embedding_and_output",
      "runtime_layout": "not_runtime_loadable",
      "sha256": "5a878aab98a988c5479b48c00d8e2bef988c946dc648583ffe7ac598d76bacd5",
      "sources": [
        {
          "name": "model.language_model.embed_tokens.weight",
          "range": {
            "absolute_offset": 264,
            "byte_length": 128,
            "range_identity_sha256": "bce590f21607634beca0b36dad5a071a757cbed0202b98a4e7aa80dc017ba458",
            "shard": "model-00001-of-00002.safetensors",
            "shard_sha256": "574547c04aed92d0e27cc5ebe483e270031c1b0ebb4a4117187b83492d8cd346"
          },
          "sha256": "5a878aab98a988c5479b48c00d8e2bef988c946dc648583ffe7ac598d76bacd5"
        }
      ],
      "transformation": "identity-copy",
      "transformation_version": 1
    },
    {
      "aliased": false,
      "axis_transformation": "identity",
      "byte_length": 16,
      "dequantization_equation": "output = source",
      "disk_layout": "source_bf16",
      "logical_dtype": "BF16",
      "logical_shape": [
        2,
        4
      ],
      "operation_id": "copy:model.language_model.layers.0.router.proj.weight",
      "output_data_offsets": [
        0,
        16
      ],
      "output_dtype": "BF16",
      "output_name": "model.language_model.layers.0.router.proj.weight",
      "output_shard": "model-00002-of-00002.safetensors",
      "physical_shape": [
        2,
        4
      ],
      "quantizer_parameters": {},
      "residency_class": "compiler_scaffold_text",
      "role": "router_projection",
      "runtime_layout": "not_runtime_loadable",
      "sha256": "d0b9d375b5cf86ad08665a9a10db0f780a14955cc7a674d2e729aeeeb661736f",
      "sources": [
        {
          "name": "model.language_model.layers.0.router.proj.weight",
          "range": {
            "absolute_offset": 272,
            "byte_length": 16,
            "range_identity_sha256": "ee33542d536099c7549dc42ad3581680ab61bcd73ccb27ec6755225f3b2f9f05",
            "shard": "model-00002-of-00002.safetensors",
            "shard_sha256": "c01fba16e43271a79699dd5a154722b8316c5d8ea216e593d4d2d4197c944f20"
          },
          "sha256": "d0b9d375b5cf86ad08665a9a10db0f780a14955cc7a674d2e729aeeeb661736f"
        }
      ],
      "transformation": "identity-copy",
      "transformation_version": 1
    },
    {
      "aliased": false,
      "axis_transformation": "identity",
      "byte_length": 32,
      "dequantization_equation": "output = source",
      "disk_layout": "source_bf16",
      "logical_dtype": "BF16",
      "logical_shape": [
        4,
        4
      ],
      "operation_id": "copy:model.language_model.layers.0.self_attn.q_proj.weight",
      "output_data_offsets": [
        16,
        48
      ],
      "output_dtype": "BF16",
      "output_name": "model.language_model.layers.0.self_attn.q_proj.weight",
      "output_shard": "model-00002-of-00002.safetensors",
      "physical_shape": [
        4,
        4
      ],
      "quantizer_parameters": {},
      "residency_class": "compiler_scaffold_text",
      "role": "attention_q_projection",
      "runtime_layout": "not_runtime_loadable",
      "sha256": "0cf549686a51df8a46b5e9759cf515bb67c00653cc23e0cf6f50e2fe17c9a75e",
      "sources": [
        {
          "name": "model.language_model.layers.0.self_attn.q_proj.weight",
          "range": {
            "absolute_offset": 288,
            "byte_length": 32,
            "range_identity_sha256": "593d41bc65c8d78a8eb214d63cd4d9c4b17e7289ffea22f441d7f1baca56f288",
            "shard": "model-00002-of-00002.safetensors",
            "shard_sha256": "c01fba16e43271a79699dd5a154722b8316c5d8ea216e593d4d2d4197c944f20"
          },
          "sha256": "0cf549686a51df8a46b5e9759cf515bb67c00653cc23e0cf6f50e2fe17c9a75e"
        }
      ],
      "transformation": "identity-copy",
      "transformation_version": 1
    }
  ],
  "text_only": true
}
